{
    "$schema": "../../audio-manifest.schema.json",
    "formatVersion": 1,
    "id": "main-theme",
    "category": "bgm",
    "generator": {
        "tool": "FFmpeg 9.0.1",
        "sourceFormat": "user-supplied-mp3-44.1khz-192kbps"
    },
    "clips": {
        "climb": {
            "playback": "stream",
            "channels": "stereo",
            "durationSeconds": 203.911854,
            "sources": [
                { "path": "main-theme.ogg", "mimeType": "audio/ogg" },
                { "path": "main-theme.mp3", "mimeType": "audio/mpeg" }
            ]
        },
        "run-complete": {
            "playback": "stream",
            "channels": "stereo",
            "durationSeconds": 2,
            "sources": [{ "path": "run-complete.wav", "mimeType": "audio/wav" }],
            "loop": { "startSeconds": 0, "endSeconds": 2 }
        }
    },
    "cues": {
        "bgm-climb": {
            "group": "bgm",
            "kind": "loop",
            "clips": [{ "clip": "climb" }],
            "spatial": "none",
            "priority": 10,
            "transitionMs": 1500
        },
        "bgm-run-complete": {
            "group": "bgm",
            "kind": "loop",
            "clips": [{ "clip": "run-complete" }],
            "spatial": "none",
            "priority": 10,
            "transitionMs": 1500
        }
    }
}
