{
    "$schema": "../../audio-manifest.schema.json",
    "formatVersion": 1,
    "id": "default-mock",
    "category": "gameplay",
    "generator": { "tool": "scripts/generateAudioMockAssets.mjs", "sourceFormat": "procedural-pcm" },
    "clips": {
        "rope-attach": {
            "playback": "buffer",
            "channels": "mono",
            "durationSeconds": 0.18,
            "sources": [{ "path": "rope-attach.wav", "mimeType": "audio/wav" }]
        },
        "weapon-fire-a": {
            "playback": "buffer",
            "channels": "mono",
            "durationSeconds": 0.1,
            "sources": [{ "path": "weapon-fire-a.wav", "mimeType": "audio/wav" }]
        },
        "weapon-fire-b": {
            "playback": "buffer",
            "channels": "mono",
            "durationSeconds": 0.1,
            "sources": [{ "path": "weapon-fire-b.wav", "mimeType": "audio/wav" }]
        },
        "player-hit": {
            "playback": "buffer",
            "channels": "mono",
            "durationSeconds": 0.22,
            "sources": [{ "path": "player-hit.wav", "mimeType": "audio/wav" }]
        },
        "checkpoint-reached": {
            "playback": "buffer",
            "channels": "mono",
            "durationSeconds": 0.42,
            "sources": [{ "path": "checkpoint-reached.wav", "mimeType": "audio/wav" }]
        },
        "direction-relay-trip-settle": {
            "playback": "buffer",
            "channels": "mono",
            "durationSeconds": 0.48,
            "sources": [{ "path": "direction-relay-trip-settle.wav", "mimeType": "audio/wav" }]
        },
        "direction-air-rope-landing": {
            "playback": "buffer",
            "channels": "mono",
            "durationSeconds": 0.45,
            "sources": [{ "path": "direction-air-rope-landing.wav", "mimeType": "audio/wav" }]
        },
        "direction-cable-brake-settle": {
            "playback": "buffer",
            "channels": "mono",
            "durationSeconds": 0.55,
            "sources": [{ "path": "direction-cable-brake-settle.wav", "mimeType": "audio/wav" }]
        },
        "direction-free-air-attach": {
            "playback": "buffer",
            "channels": "mono",
            "durationSeconds": 0.38,
            "sources": [{ "path": "direction-free-air-attach.wav", "mimeType": "audio/wav" }]
        },
        "direction-rope-air-priority": {
            "playback": "buffer",
            "channels": "mono",
            "durationSeconds": 0.28,
            "sources": [{ "path": "direction-rope-air-priority.wav", "mimeType": "audio/wav" }]
        },
        "direction-security-beep-servo": {
            "playback": "buffer",
            "channels": "mono",
            "durationSeconds": 0.6,
            "sources": [{ "path": "direction-security-beep-servo.wav", "mimeType": "audio/wav" }]
        }
    },
    "cues": {
        "gameplay-rope-attach": {
            "group": "gameplay",
            "kind": "one-shot",
            "clips": [{ "clip": "rope-attach" }],
            "spatial": "world",
            "maxVoices": 2,
            "retriggerCooldownMs": 80,
            "priority": 55
        },
        "gameplay-weapon-fire": {
            "group": "gameplay",
            "kind": "one-shot",
            "clips": [
                { "clip": "weapon-fire-a", "weight": 1 },
                { "clip": "weapon-fire-b", "weight": 1 }
            ],
            "spatial": "world",
            "maxVoices": 4,
            "retriggerCooldownMs": 40,
            "priority": 45,
            "pitchRandomizationPercent": 2,
            "gainRandomizationDb": 1
        },
        "gameplay-action-swing": {
            "group": "gameplay",
            "kind": "one-shot",
            "clips": [
                { "clip": "weapon-fire-a", "weight": 1 },
                { "clip": "weapon-fire-b", "weight": 1 }
            ],
            "spatial": "world",
            "gainDb": -2,
            "maxVoices": 3,
            "retriggerCooldownMs": 80,
            "priority": 60,
            "pitchRandomizationPercent": 3,
            "gainRandomizationDb": 1
        },
        "gameplay-player-hit": {
            "group": "gameplay",
            "kind": "one-shot",
            "clips": [{ "clip": "player-hit" }],
            "spatial": "world",
            "maxVoices": 2,
            "retriggerCooldownMs": 80,
            "priority": 90,
            "minGainDb": -18,
            "ducking": [
                { "group": "bgm", "gainDb": -6, "attackMs": 50, "releaseMs": 400 },
                { "group": "ambience", "gainDb": -3, "attackMs": 50, "releaseMs": 400 }
            ]
        },
        "gameplay-boss-beam-telegraph": {
            "group": "gameplay",
            "kind": "one-shot",
            "clips": [{ "clip": "direction-security-beep-servo" }],
            "spatial": "world",
            "maxVoices": 1,
            "retriggerCooldownMs": 350,
            "priority": 82
        },
        "gameplay-boss-beam-sweep": {
            "group": "gameplay",
            "kind": "one-shot",
            "clips": [{ "clip": "direction-cable-brake-settle" }],
            "spatial": "world",
            "maxVoices": 1,
            "retriggerCooldownMs": 350,
            "priority": 84
        },
        "gameplay-boss-beam-break": {
            "group": "gameplay",
            "kind": "one-shot",
            "clips": [{ "clip": "direction-relay-trip-settle" }],
            "spatial": "world",
            "maxVoices": 1,
            "retriggerCooldownMs": 1000,
            "priority": 92
        },
        "gameplay-boss-ram-telegraph": {
            "group": "gameplay",
            "kind": "one-shot",
            "clips": [{ "clip": "direction-security-beep-servo" }],
            "spatial": "world",
            "gainDb": -1,
            "maxVoices": 1,
            "retriggerCooldownMs": 350,
            "priority": 86
        },
        "gameplay-boss-ram-impact": {
            "group": "gameplay",
            "kind": "one-shot",
            "clips": [{ "clip": "player-hit" }],
            "spatial": "world",
            "gainDb": 1,
            "maxVoices": 2,
            "retriggerCooldownMs": 120,
            "priority": 95,
            "minGainDb": -18
        },
        "gameplay-checkpoint-reached": {
            "group": "gameplay",
            "kind": "one-shot",
            "clips": [{ "clip": "checkpoint-reached" }],
            "spatial": "world",
            "maxVoices": 1,
            "retriggerCooldownMs": 500,
            "priority": 80
        },
        "direction-relay-trip-settle": {
            "group": "gameplay",
            "kind": "one-shot",
            "clips": [{ "clip": "direction-relay-trip-settle" }],
            "spatial": "world",
            "maxVoices": 1,
            "retriggerCooldownMs": 500,
            "priority": 70
        },
        "direction-rope-priority": {
            "group": "gameplay",
            "kind": "one-shot",
            "clips": [{ "clip": "rope-attach" }],
            "spatial": "world",
            "gainDb": -5,
            "maxVoices": 1,
            "retriggerCooldownMs": 350,
            "priority": 58
        },
        "direction-air-rope-landing": {
            "group": "gameplay",
            "kind": "one-shot",
            "clips": [{ "clip": "direction-air-rope-landing" }],
            "spatial": "world",
            "maxVoices": 1,
            "retriggerCooldownMs": 500,
            "priority": 62
        },
        "direction-cable-brake-settle": {
            "group": "gameplay",
            "kind": "one-shot",
            "clips": [{ "clip": "direction-cable-brake-settle" }],
            "spatial": "world",
            "maxVoices": 1,
            "retriggerCooldownMs": 800,
            "priority": 66
        },
        "direction-free-air-attach": {
            "group": "gameplay",
            "kind": "one-shot",
            "clips": [{ "clip": "direction-free-air-attach" }],
            "spatial": "world",
            "maxVoices": 1,
            "retriggerCooldownMs": 500,
            "priority": 74
        },
        "direction-rope-air-priority": {
            "group": "gameplay",
            "kind": "one-shot",
            "clips": [{ "clip": "direction-rope-air-priority" }],
            "spatial": "world",
            "gainDb": -3,
            "maxVoices": 1,
            "retriggerCooldownMs": 500,
            "priority": 60
        },
        "direction-security-beep-servo": {
            "group": "gameplay",
            "kind": "one-shot",
            "clips": [{ "clip": "direction-security-beep-servo" }],
            "spatial": "world",
            "maxVoices": 1,
            "retriggerCooldownMs": 1000,
            "priority": 78
        }
    }
}
